{
  "$schema": "./$schema.json",
  "name": "Standard",
  "width": 989,
  "height": 1240,
  "supported-rarities": ["common", "rare", "epic", "legendary"],
  "supported-types": ["troop", "building", "spell"],
  "fields": {
    "card-name": {
      "x": 649,
      "y": 88,
      "fontSize": 58,
      "maxWidth": 660,
      "color": "#fff"
    },
    "level": {
      "x": 649,
      "y": 154,
      "fontSize": 40,
      "color": {
        "common": "#a4cbfa",
        "rare": "#f7ce76",
        "epic": "#f19ef9",
        "legendary": ["#9f6", "#fff", "#f9f", "#ff9", "#66fffc"],
        "champion": ["#f9dd50", "#fdfadf"]
      }
    },
    "image": {
      "x": 31,
      "y": 47,
      "width": 242,
      "height": 332
    },
    "elixir-cost": {
      "x": 15,
      "y": 49,
      "width": 63,
      "height": 75,
      "fontSize": 41
    },
    "rarity-background": {
      "x": 307,
      "y": 307,
      "width": 228,
      "height": 85,
      "url": {
        "common": "/cards-assets/rarity-backgrounds/standard/common.png",
        "rare": "/cards-assets/rarity-backgrounds/standard/rare.png",
        "epic": "/cards-assets/rarity-backgrounds/standard/epic.png",
        "legendary": "/cards-assets/rarity-backgrounds/standard/legendary.png",
        "champion": "/cards-assets/rarity-backgrounds/standard/legendary.png"
      }
    },
    "rarity-label": {
      "x": 428,
      "y": 331,
      "fontSize": 28,
      "maxWidth": 150,
      "textAlign": "center",
      "color": {
        "common": "#3a568d",
        "rare": "#7a3f15",
        "epic": "#5c1d76",
        "legendary": "#2e6851",
        "champion": "#815e1f"
      }
    },
    "rarity-value": {
      "x": 428,
      "y": 390,
      "fontSize": 34,
      "maxWidth": 190,
      "textAlign": "center",
      "color": {
        "common": "#a7c9fa",
        "rare": "#f2d171",
        "epic": "#ddb3f9",
        "legendary": ["#9f6", "#fff", "#f9f", "#ff9", "#66fffc"],
        "champion": ["#f9dd50", "#fdfadf"]
      }
    },
    "type-background": {
      "x": 565,
      "y": 307,
      "width": 228,
      "height": 85,
      "url": {
        "common": "/cards-assets/rarity-backgrounds/standard/common.png",
        "rare": "/cards-assets/rarity-backgrounds/standard/rare.png",
        "epic": "/cards-assets/rarity-backgrounds/standard/epic.png",
        "legendary": "/cards-assets/rarity-backgrounds/standard/legendary.png",
        "champion": "/cards-assets/rarity-backgrounds/standard/legendary.png"
      }
    },
    "type-label": {
      "x": 685,
      "y": 331,
      "fontSize": 28,
      "maxWidth": 190,
      "textAlign": "center",
      "color": {
        "common": "#3a568d",
        "rare": "#7a3f15",
        "epic": "#5c1d76",
        "legendary": "#2e6851",
        "champion": "#815e1f"
      }
    },
    "type-value": {
      "x": 685,
      "y": 390,
      "fontSize": 34,
      "maxWidth": 190,
      "textAlign": "center",
      "color": {
        "common": "#a7c9fa",
        "rare": "#f2d171",
        "epic": "#ddb3f9",
        "legendary": ["#9f6", "#fff", "#f9f", "#ff9", "#66fffc"],
        "champion": ["#f9dd50", "#fdfadf"]
      }
    }
  },
  "pages": [
    {
      "name": "Stats",
      "x": 0,
      "y": 0,
      "width": 989,
      "height": 1240,
      "background": "/cards-assets/backgrounds/standard-stats.png",
      "fields": {
        "stats": {
          "x": 58,
          "y": 486,
          "gapX": 19,
          "gapY": 6,
          "maxItems": 14,
          "itemsPerRow": 2,
          "items": {
            "width": 425,
            "height": 85,
            "oddBackground": "/cards-assets/backgrounds/standard-stat-bg.svg",
            "evenBackground": "/cards-assets/backgrounds/standard-stat-bg.svg",
            "icon": {
              "dx": 8,
              "dy": 4,
              "width": 73,
              "height": 73,
              "backgroundColor": "#1d232e"
            },
            "name": {
              "dx": 90,
              "dy": 12,
              "fontSize": 33,
              "maxWidth": 330,
              "color": "#384457"
            },
            "value": {
              "dx": 90,
              "dy": 51,
              "fontSize": 33,
              "maxWidth": 330,
              "color": "#fff"
            }
          }
        }
      }
    },
    {
      "name": "Description",
      "x": 0,
      "y": 0,
      "width": 989,
      "height": 1240,
      "background": "/cards-assets/backgrounds/standard-description.png",
      "fields": {
        "description": {
          "x": 495,
          "y": 532,
          "maxWidth": 760,
          "fontSize": 40,
          "lineHeight": 44,
          "maxLines": 9,
          "textBaseline": "middle",
          "color": "#4a566b"
        }
      }
    }
  ],
  "i18n": {
    "en": {
      "name": "{{cardName}}",
      "level": "Level {{level}}",
      "rarity-label": "RARITY",
      "rarity-common": "Common",
      "rarity-rare": "Rare",
      "rarity-epic": "Epic",
      "rarity-legendary": "Legendary",
      "rarity-champion": "Champion",
      "type-label": "TYPE",
      "type-troop": "Troop",
      "type-building": "Building",
      "type-spell": "Spell",
      "type-tower-troop": "Tower Troop"
    }
  }
}
